{
  "schema_version": 2,
  "candidate": {
    "name": "cdpkit",
    "version": "0.4.0",
    "checksum": "c3fdb566d913b31e0014391a94c0db4ed871dbb76577dd1b2f2c5f6df158bfaa"
  },
  "source": {
    "git_revision": "3d7c96ccf20862c47ab70ffbd7f724dceedfb4d2",
    "protocol_revision": "unavailable (cdpkit generated CDP_VERSION=1.3)",
    "rust_version": "rustc 1.97.0 (2d8144b78 2026-07-07)"
  },
  "environment": {
    "platform": "macos",
    "architecture": "aarch64"
  },
  "browser": {
    "product": "Chrome/149.0.7827.201",
    "protocol": "1.3",
    "revision": "@6a7b3dbec3b2ca25877c2553b5473b2f277ef644"
  },
  "fixture": {
    "name": "cdp-transport-gate",
    "sha256": "sha256sum-of-ordered-fixture-files:9b42ae730d12a95772a946bf55e4838a5443b6cb4c536424570219041b6e2a68:84ba666539a996012a781637c1a894d8c7a4789cfca84661bd7cf8b79efa2e13"
  },
  "configuration": {
    "minimum_seconds": 60.0,
    "minimum_frames": 1000,
    "saturation_seconds": 10.0,
    "saturation_attempts": 100,
    "hard_stop_seconds": 120
  },
  "gate_provenance": {
    "implementation_revision": "3d7c96ccf20862c47ab70ffbd7f724dceedfb4d2",
    "configuration_sha256": "sha256:06388b5f8ad042093d22408dedb8d02d5a04a9e59d485158edc533334bab956e"
  },
  "gates": [
    {
      "id": "deterministic-routing",
      "status": "pass",
      "summary": "real-Chrome gate passed",
      "measurements": {
        "commands": 200.0,
        "cross_delivery": 0.0,
        "events": 200.0
      },
      "failure": null
    },
    {
      "id": "typed-domains",
      "status": "pass",
      "summary": "real-Chrome gate passed",
      "measurements": {
        "typed_operations": 5.0
      },
      "failure": null
    },
    {
      "id": "flat-session-isolation",
      "status": "pass",
      "summary": "real-Chrome gate passed",
      "measurements": {
        "commands_per_session": 100.0,
        "cross_delivery": 0.0,
        "events_per_session": 100.0,
        "sessions": 2.0
      },
      "failure": null
    },
    {
      "id": "raw-browser-command",
      "status": "pass",
      "summary": "real-Chrome gate passed",
      "measurements": {
        "commands": 1.0
      },
      "failure": null
    },
    {
      "id": "raw-session-command",
      "status": "pass",
      "summary": "real-Chrome gate passed",
      "measurements": {
        "commands": 1.0
      },
      "failure": null
    },
    {
      "id": "named-raw-event-params",
      "status": "pass",
      "summary": "real-Chrome gate passed",
      "measurements": {
        "named_events": 1.0
      },
      "failure": null
    },
    {
      "id": "protocol-drift-survival",
      "status": "pass",
      "summary": "candidate wire-contract drift trace attached; not a real-Chrome fixture measurement",
      "measurements": {
        "connection_survived": 1.0,
        "fixtures": 3.0,
        "wildcard_envelope_available": 0.0
      },
      "failure": null
    },
    {
      "id": "sustained-screencast",
      "status": "pass",
      "summary": "real-Chrome gate passed",
      "measurements": {
        "ack_latency_ms_max": 556.233375,
        "ack_latency_ms_p50": 16.535749999999997,
        "ack_latency_ms_p95": 20.596917,
        "ack_latency_ms_p99": 22.518792,
        "elapsed_seconds": 60.019783292,
        "frames_acknowledged": 3571.0,
        "frames_received": 3571.0,
        "handoff_accepted": 1.0,
        "handoff_dropped": 3570.0,
        "rss_first_window_median_bytes": 10780672.0,
        "rss_last_window_median_bytes": 10780672.0,
        "rss_peak_bytes": 10780672.0,
        "rss_samples": 51.0,
        "rss_sampling_interval_seconds": 1.0,
        "rss_theil_sen_bytes_per_minute": 0.0,
        "rss_warmup_seconds": 10.0,
        "saturation_attempts": 3571.0,
        "saturation_seconds": 60.019783292,
        "upstream_queue_depth_available": 0.0
      },
      "failure": null
    },
    {
      "id": "prompt-acknowledgement",
      "status": "pass",
      "summary": "real-Chrome gate passed",
      "measurements": {
        "ack_before_handoff": 1.0,
        "ack_latency_ms_max": 556.233375,
        "ack_latency_ms_p50": 16.535749999999997,
        "ack_latency_ms_p95": 20.596917,
        "ack_latency_ms_p99": 22.518792
      },
      "failure": null
    },
    {
      "id": "bounded-handoff-saturation",
      "status": "pass",
      "summary": "real-Chrome gate passed",
      "measurements": {
        "handoff_accepted": 1.0,
        "handoff_attempts": 3571.0,
        "handoff_dropped": 3570.0,
        "saturation_seconds": 60.019783292
      },
      "failure": null
    },
    {
      "id": "bounded-memory-proxy",
      "status": "pass",
      "summary": "real-Chrome gate passed",
      "measurements": {
        "rss_first_window_median_bytes": 10780672.0,
        "rss_growth_bytes": 0.0,
        "rss_last_window_median_bytes": 10780672.0,
        "rss_peak_bytes": 10780672.0,
        "rss_samples": 51.0,
        "rss_sampling_interval_seconds": 1.0,
        "rss_theil_sen_bytes_per_minute": 0.0,
        "rss_warmup_seconds": 10.0,
        "upstream_queue_depth_available": 0.0
      },
      "failure": null
    },
    {
      "id": "disconnect-cleanup",
      "status": "pass",
      "summary": "real-Chrome gate passed",
      "measurements": {
        "close_reason_observed": 1.0,
        "pending_calls_closed": 1.0,
        "pending_command_elapsed_seconds": 0.0211495,
        "pending_command_started": 1.0,
        "subscription_elapsed_seconds": 0.021154,
        "subscriptions_closed": 1.0
      },
      "failure": null
    },
    {
      "id": "explicit-reconnect-rebuild",
      "status": "pass",
      "summary": "real-Chrome gate passed",
      "measurements": {
        "connections": 2.0,
        "elapsed_seconds": 2.97012425,
        "sessions_rebuilt": 2.0
      },
      "failure": null
    }
  ],
  "limitations": [
    "cdpkit exposes named event params through an unbounded subscriber; wildcard/full-envelope receive and queue-depth introspection are unavailable",
    "ack latency values are receive-to-ack-completion proxies, not wire-enqueue timestamps",
    "RSS is a process-level proxy from a continuously drained reader; it does not prove the hidden cdpkit subscriber queue is bounded",
    "candidate-contract trace digest: sha256:6c6be028c511d4d8c28cbecec368a7d4f09e0d87612741d02ac19a8663964d54"
  ],
  "candidate_contract": {
    "trace_sha256": "sha256:6c6be028c511d4d8c28cbecec368a7d4f09e0d87612741d02ac19a8663964d54",
    "trace_observations": 942,
    "results": {
      "drift_fixtures": 3,
      "connection_survived": true,
      "routing_commands": 200,
      "routing_events": 200,
      "routing_cross_delivery": 0,
      "event_before_response": true,
      "detach_during_pending": true,
      "pending_calls_closed": true,
      "subscriptions_closed": true,
      "socket_closed": true,
      "reconnect_connections": 2,
      "sessions_rebuilt": 2
    }
  }
}